{"task_key":"t05","candidate_x":{"choice_specificity":2,"load_bearing_principle":2,"trajectory_influence":2,"review_friction":0,"evidence":["Chooses conservative fallback over invalid distribution: “removes only that unsafe evaluation.”","Identifies the algebraic invariant: a product of a sum cannot be transformed into a sum of products.","The patch preserves a distinct supported path for rational products when numerator and denominator products are evaluable."]},"candidate_y":{"choice_specificity":2,"load_bearing_principle":2,"trajectory_influence":2,"review_friction":0,"evidence":["Chooses unevaluated preservation because this revision lacks q-Pochhammer support.","Identifies the same algebraic invariant and scopes it to unsupported symbolic additive products.","The patch directly removes the invalid additive fallback and returns `None` for unsupported cases."]},"winner":"tie","confidence":"high","reason":"Both candidates make a concrete conservative choice, ground it in the same load-bearing algebraic invariant, and visibly shape the patch around removing the unsafe transformation while preserving an unevaluated fallback. X gives somewhat richer preservation reasoning, while Y gives a clear capability-boundary rationale; neither is materially stronger on at least two positive dimensions including trajectory influence."}