{"task_key":"t01","candidate_x":{"choice_specificity":2,"load_bearing_principle":2,"trajectory_influence":2,"review_friction":0,"evidence":["Chooses normalization of an inverse presentation letter to its underlying generator rather than retaining the failing membership test.","Explains that presentation relators use free generators and that inverse letters break positive-generator lookup.","The patch changes the permutation-group branch to normalize `g` before positional mapping."]},"candidate_y":{"choice_specificity":2,"load_bearing_principle":2,"trajectory_influence":2,"review_friction":0,"evidence":["Chooses compact sign normalization before positional lookup instead of checking each letter for membership.","Clarifies the invariant that the normalized generator selects the mapping while the signed exponent remains responsible for inversion.","The patch directly replaces the membership-gated branch with normalization followed by generator lookup."]},"winner":"tie","confidence":"high","reason":"Both candidates make the same situated choice, articulate essentially the same generator/sign responsibility, and shape the patch in materially equivalent ways. Neither has meaningful review friction, so neither is stronger on the required two positive dimensions including trajectory influence."}