{"task_key":"t07","candidate_x":{"choice_specificity":2,"load_bearing_principle":2,"trajectory_influence":2,"review_friction":0,"evidence":["Chooses a narrow cutoff-branch change over altering general formatting: values below the smallest visible decimal place flow through as signed zero.","Preserves the stated interface boundary: large values and calls without `decimal_pos` remain scientific.","The patch implements that decision directly at the cutoff and leaves the existing scientific-format path intact."]},"candidate_y":{"choice_specificity":2,"load_bearing_principle":2,"trajectory_influence":2,"review_friction":0,"evidence":["Chooses a narrow cutoff branch based on whether the most-significant digit lies beyond the requested precision.","Identifies sign preservation, including exponent-carrying negative zero, as an invariant of the fixed-zero path.","The adjacent zero case visibly shapes both the branch condition (`number.is_zero()`) and the stated regression scope."]},"winner":"tie","confidence":"high","reason":"Both candidates make the same situated architectural choice, explain the cutoff and preservation invariants, and visibly constrain the patch to a narrow branch. Y adds a thoughtful exponent-carrying-zero consideration, while X explicitly addresses an existing expectation, but neither is materially stronger across at least two positive dimensions including trajectory influence."}