{"task_key":"t01-pass2","candidate_x":{"choice_specificity":2,"load_bearing_principle":2,"trajectory_influence":2,"review_friction":0,"evidence":["Chooses a single presentation-generator-to-image map over fragile per-letter `gens.index(...)` translation.","The patch caches `domain.presentation()`, creates `rel_images`, and normalizes inverse letters before lookup."]},"candidate_y":{"choice_specificity":2,"load_bearing_principle":2,"trajectory_influence":2,"review_friction":0,"evidence":["Chooses one-time translation of the image dictionary so the existing generic inverse handling remains unchanged.","The patch removes the permutation-specific per-letter lookup and maps presentation generators directly to images."]},"winner":"tie","confidence":"high","reason":"Both candidates make an explicit, situated choice, identify the presentation/domain generator interface as the load-bearing concern, and visibly reshape the patch around a one-time mapping. Y preserves more existing evaluation logic while X adds explicit normalization, but neither is materially stronger on at least two positive dimensions including trajectory influence."}