{"task_key":"t08r1","candidate_x":{"choice_specificity":2,"load_bearing_principle":2,"trajectory_influence":2,"review_friction":0,"evidence":["Explicitly chooses `lexer=\"text\"` over version-dependent `python3`/`python` because the submitted content is arbitrary terminal output, not Python.","The rationale shapes the narrow patch: only the request payload’s lexer field changes, while transport compatibility is preserved."]},"candidate_y":{"choice_specificity":2,"load_bearing_principle":2,"trajectory_influence":2,"review_friction":0,"evidence":["Explicitly chooses `text` because the request payload contains arbitrary terminal output incorrectly labeled as Python.","The localized diagnosis directly shapes the patch to replace the version-dependent lexer with `\"text\"` and keep the scope narrow."]},"winner":"tie","confidence":"high","reason":"Both candidates make the same situated choice, articulate essentially the same data-semantics principle, and visibly produce the same narrow implementation trajectory. Neither introduces review friction, so neither is materially stronger on the required dimensions."}