{"task_key":"t09","candidate_x":{"choice_specificity":2,"load_bearing_principle":2,"trajectory_influence":2,"review_friction":0,"evidence":["Chooses a local `io.FileInput` wrapper while retaining Docutils’ include machinery instead of reimplementing its parser.","The stated invariant—preserving slicing, encoding, dependency tracking, diagnostics, and standard includes—directly shapes the narrow patch.","The patch emits `source-read` from the actual include read and restores `io.FileInput` in `finally`."]},"candidate_y":{"choice_specificity":2,"load_bearing_principle":2,"trajectory_influence":2,"review_friction":0,"evidence":["Explicitly chooses a dedicated `include-read` hook over changing the document-oriented meaning of `source-read`.","Defines a clear interface carrying included relative path, parent docname, and mutable content before include options are applied.","That ownership decision visibly expands the patch to register a new core event and emit it from a locally substituted Docutils input class."]},"winner":"tie","confidence":"high","reason":"Both candidates make equally specific, principle-driven choices that strongly determine their patches, with no meaningful review friction. Y’s distinct event semantics and X’s reuse of the existing event are different engineering preferences, but neither is materially stronger on at least two positive dimensions including trajectory influence."}