{"task_key":"t06","candidate_x":{"choice_specificity":2,"load_bearing_principle":2,"trajectory_influence":2,"review_friction":0,"evidence":["Chooses a default-setting change because the implementation “funnels the global setting into `FileSystemStorage`.”","Preserves explicit `FILE_UPLOAD_PERMISSIONS=None` as the platform-dependent escape hatch.","The stated principle shapes the patch scope: default, cached-setting assertion, stale documentation, deployment warning, and release note."]},"candidate_y":{"choice_specificity":2,"load_bearing_principle":2,"trajectory_influence":2,"review_friction":0,"evidence":["Chooses `0o644` while retaining explicit `None` for umask/temporary-file behavior.","Identifies shared data flow: the default affects both saved uploads and `collectstatic`.","That downstream effect visibly expands the final sweep to storage/staticfiles coverage and aligned documentation."]},"winner":"tie","confidence":"high","reason":"Both candidates make the same situated choice, explain the controlling setting and explicit-None invariant, and visibly use that reasoning to shape scope. Y adds the `collectstatic` consequence, but it is not materially stronger than X on at least two positive dimensions including trajectory influence."}