{"task_key":"t02","candidate_x":{"choice_specificity":2,"load_bearing_principle":2,"trajectory_influence":2,"review_friction":0,"evidence":["Chooses construction-time normalization over leaving the partial classified as `functools.partial`.","Preserves partial invocation semantics by prepending bound positional arguments and giving resolution-time keywords precedence.","The patch directly implements that normalization in `ResolverMatch.__init__`."]},"candidate_y":{"choice_specificity":2,"load_bearing_principle":2,"trajectory_influence":2,"review_friction":0,"evidence":["Explicitly considers folding bound values into public match arguments versus representing them separately, noting compatibility implications.","Uses the documented invariant that the resolver tuple contains “the function and arguments that would be invoked,” including partial keyword precedence.","The patch directly reflects the selected invocation-preserving design in `ResolverMatch.__init__`."]},"winner":"tie","confidence":"high","reason":"Both candidates make the same situated choice, articulate the same invocation-semantics invariant, and produce the identical implementation patch. Y states the rejected alternative and contract somewhat more explicitly, but it does not materially exceed X on trajectory influence or a second positive dimension, so the paired-verdict rule requires a tie."}