{"task_key":"t04","candidate_x":{"choice_specificity":2,"load_bearing_principle":2,"trajectory_influence":2,"review_friction":0,"evidence":["Chooses to register delayed teardown only when unittest reaches its teardown phase, instead of recording it before skip resolution.","Explains the lifecycle invariant: skipped or incompletely set-up tests must not manufacture a teardown call, while executed tests retain delayed teardown.","Patch replaces the no-op teardown with `delayed_tearDown`, which records the real callback only when invoked."]},"candidate_y":{"choice_specificity":2,"load_bearing_principle":2,"trajectory_influence":2,"review_friction":0,"evidence":["Chooses deferred teardown registration over pytest's prior eager bookkeeping.","Identifies ownership of the lifecycle decision: unittest determines whether teardown is reached after resolving skips.","Patch replaces the no-op teardown with `delayed_teardown`, recording the real callback only upon entry to the teardown phase."]},"winner":"tie","confidence":"high","reason":"Both candidates articulate the same concrete lifecycle preference, use the same load-bearing invariant, and apply materially identical patches. Neither creates review friction, so neither is stronger on the required dimensions."}